id,title,field_body,author,slug,image_reference,tags
1,Prueba y cultiva tus propias hierbas,give-it-a-go-and-grow-your-own-herbs.html,Holly Foat,articles/prueba-y-cultiva-tus-propias-hierbas,10,"14,23,16"
2,Delicioso chocolate sin lactosa,dairy-free-delicious-milk-chocolate.html,Umami,articles/delicioso-chocolate-sin-lactosa,11,"27,7"
3,El verdadero negocio para comprar en el supermercado,the-real-deal-for-supermarket-savvy-shopping.html,Gregorio Sánchez,articles/el-verdadeo-negocio-para-comprar-en-el-supermercado,12,"26,24"
4,Guía Umami de nuestras setas preferidas,the-umami-guide-to-our-favourite-mushrooms.html,Umami,articles/guia-umami-de-nuestras-setas-preferidas,13,"18,28"
5,Un aplauso para las zanahorias,lets-hear-it-for-carrots.html,Umami,articles/un-aplauso-para-las-zanahorias,14,"6,28,15"
6,Percances al hornear - nuestros consejos para solucionar los problemas,baking-mishaps-our-troubleshooting-tips.html,Umami,articles/percances-al-hornear-nuestros-consejos-para-solucionar-problemas,15,"3,17"
7,Salta los espíritus con deliciosos cócteles sin alcohol,skip-the-spirits-with-delicious-mocktails.html,Gregorio Sánchez,articles/salta-los-espiritus-con-deliciosos-cocteles-sin-alcohol,16,"1,12,20,8,11"
8,Dale a tu avena el cambio de imagen definitivo,give-your-oatmeal-the-ultimate-makeover.html,Umami,articles/dale-a-tu-avena-el-cambio-de-imagen-definitivo,17,"27,28,19,4,10"
